{
  "metadata": {
    "schema_version": "mg0.alphagenome_parity_audit.v1",
    "sprint": "MG0-A AlphaGenome Official Code Parity Audit",
    "generated_at": "2026-07-13T13:43:29+08:00",
    "audit_status": "FROZEN_WITH_NEEDS_VERIFICATION",
    "parity_verdict": "PARTIAL_PUBLISHED_CODE_PARITY",
    "gate_decision": "PASS_WITH_NEEDS_VERIFICATION",
    "official_commit": "232fc695d1eab27bac9e94bcd4b50499139ba4e1",
    "local_head": "ed738d92ab76df03b4d25ebb741e33048c9aae09",
    "implementation_added": false
  },
  "source_evidence": {
    "paper": "https://www.nature.com/articles/s41586-025-10014-0",
    "supplementary_information": "https://static-content.springer.com/esm/art%3A10.1038%2Fs41586-025-10014-0/MediaObjects/41586_2025_10014_MOESM1_ESM.pdf",
    "supplementary_tables": "https://static-content.springer.com/esm/art%3A10.1038%2Fs41586-025-10014-0/MediaObjects/41586_2025_10014_MOESM3_ESM.xlsx",
    "official_repository": "https://github.com/google-deepmind/alphagenome_research/tree/232fc695d1eab27bac9e94bcd4b50499139ba4e1",
    "local_parity_checks": [
      "git merge-base --is-ancestor upstream/main HEAD exited 0",
      "git diff upstream/main..HEAD -- src/alphagenome_research produced no diff"
    ],
    "inspected_files": [
      "src/alphagenome_research/model/model.py",
      "src/alphagenome_research/model/attention.py",
      "src/alphagenome_research/model/convolutions.py",
      "src/alphagenome_research/model/layers.py",
      "src/alphagenome_research/model/embeddings.py",
      "src/alphagenome_research/model/heads.py",
      "src/alphagenome_research/model/losses.py",
      "src/alphagenome_research/model/augmentation.py",
      "src/alphagenome_research/model/schemas.py",
      "src/alphagenome_research/model/splicing.py",
      "src/alphagenome_research/model/dna_model.py",
      "src/alphagenome_research/model/variant_scoring/variant_scoring.py",
      "src/alphagenome_research/model/variant_scoring/center_mask.py",
      "src/alphagenome_research/model/variant_scoring/gene_mask.py",
      "src/alphagenome_research/model/variant_scoring/contact_map.py",
      "src/alphagenome_research/model/variant_scoring/polyadenylation.py",
      "src/alphagenome_research/model/variant_scoring/splice_junction.py",
      "src/alphagenome_research/model/variant_scoring/calibration/calibration.py",
      "src/alphagenome_research/model/interval_scoring/interval_scoring.py",
      "src/alphagenome_research/model/interval_scoring/gene_mask.py",
      "src/alphagenome_research/io/bundles.py",
      "src/alphagenome_research/io/dataset.py",
      "src/alphagenome_research/io/fasta.py",
      "src/alphagenome_research/io/genome.py",
      "src/alphagenome_research/io/splicing.py",
      "src/alphagenome_research/evals/track_prediction.py",
      "src/alphagenome_research/evals/regression_metrics.py",
      "src/alphagenome_research/finetuning/dataset.py",
      "src/alphagenome_research/finetuning/finetune.py",
      "src/alphagenome_research/**/*_test.py"
    ],
    "evidence_boundaries": [
      "CODE_OBSERVED: model, heads, losses, loaders, evaluation, fine-tuning, prediction and scoring code",
      "PUBLISHED_ONLY: pretraining recipe, fold construction details, all-fold teachers, distillation, mutations and sequence-parallel trainer",
      "EXTERNAL_DEPENDENCY: fold enums and ISM enumeration are partly supplied by the separate alphagenome package",
      "DESIGN_INFERENCE: every MarketGenome analogue and causal modification"
    ]
  },
  "component_map": [
    {
      "component": "DNA one-hot input",
      "official_code_evidence": "schemas.py:25-29 DataBatch dna_sequence [B,S,4]; model.py:198-215 consumes it",
      "scientific_role": "Encode nucleotide identity over a fixed genomic window.",
      "market_genome_analogue": "Typed bar and feature channels with availability masks.",
      "causal_modification": "Require every value and provenance timestamp to be <= as_of; represent missing values explicitly.",
      "status": "REDESIGN",
      "risk": "Feature or label leakage hidden in preprocessing.",
      "validation_test": "Source-timestamp audit and future-suffix perturbation test."
    },
    {
      "component": "Organism conditioning",
      "official_code_evidence": "model.py:216-224; embeddings.py:58-78; heads.py:266-295 inject organism-specific embeddings and weights",
      "scientific_role": "Condition shared regulatory representation on human or mouse identity.",
      "market_genome_analogue": "Symbol, exchange, sector, session or past-derived regime identity.",
      "causal_modification": "Regime identity must be past-only and unseen identities need a defined fallback.",
      "status": "REUSE_PATTERN",
      "risk": "Identity memorization and poor unseen-symbol generalization.",
      "validation_test": "Identity shuffle plus symbol-held-out evaluation."
    },
    {
      "component": "DNA stem",
      "official_code_evidence": "convolutions.py:106-118 DnaEmbedder uses kernel-15 and residual kernel-5 convolutions",
      "scientific_role": "Extract local sequence motifs.",
      "market_genome_analogue": "Local microstructure feature stem.",
      "causal_modification": "Use explicit left padding only.",
      "status": "CAUSALIZE",
      "risk": "SAME padding exposes future positions.",
      "validation_test": "Per-position full-versus-prefix equality."
    },
    {
      "component": "Encoder and downsampling",
      "official_code_evidence": "model.py:38-55; convolutions.py:121-137; layers.py:31-52 implement seven x2 pools from /1 to /128 with skips",
      "scientific_role": "Build multi-scale genomic context.",
      "market_genome_analogue": "Causal temporal feature pyramid.",
      "causal_modification": "Timestamp every pooled output at the terminal input and use causal pooling or stride.",
      "status": "CAUSALIZE",
      "risk": "Within-bin future leakage and odd-length alignment errors.",
      "validation_test": "Per-stage shapes, terminal timestamps and prefix invariance."
    },
    {
      "component": "Standardized convolution",
      "official_code_evidence": "convolutions.py:54-103 standardizes weights and sets padding='SAME'",
      "scientific_role": "Stabilize convolutional learning.",
      "market_genome_analogue": "Weight-standardized causal convolution.",
      "causal_modification": "Replace SAME with explicit left padding and preserve length intentionally.",
      "status": "CAUSALIZE",
      "risk": "Silent time shift after padding changes.",
      "validation_test": "Impulse alignment and future perturbation tests."
    },
    {
      "component": "RMSBatchNorm",
      "official_code_evidence": "layers.py:55-99 uses batch and all spatial axes in training with EMA state",
      "scientific_role": "Normalize genomic activations.",
      "market_genome_analogue": "No direct default; per-token normalization is safer.",
      "causal_modification": "Replace with per-token LayerNorm/RMSNorm or frozen train-only past statistics.",
      "status": "REDESIGN",
      "risk": "Future tokens affect historical outputs in training mode.",
      "validation_test": "Train/inference state update tests and prefix invariance."
    },
    {
      "component": "Transformer tower, MQA and RoPE",
      "official_code_evidence": "model.py:76-90; attention.py:116-174 implement nine unmasked residual attention blocks with 8Q/1KV",
      "scientific_role": "Model long-range regulatory context.",
      "market_genome_analogue": "Long-range temporal context.",
      "causal_modification": "Apply a hard causal mask after tanh soft-cap and before softmax, or use masked softmax; also enforce session, roll and gap boundaries with time-aware positions.",
      "status": "CAUSALIZE",
      "risk": "Future attention remains reachable through logits or learned bias.",
      "validation_test": "Full-versus-prefix equality at every transformer layer."
    },
    {
      "component": "Pair update and attention bias",
      "official_code_evidence": "attention.py:177-299 constructs /2048 sequence-to-pair features, full row attention and pair-derived bias",
      "scientific_role": "Feed pairwise genomic relations back into sequence attention.",
      "market_genome_analogue": "Directional time-to-time or anchor relations.",
      "causal_modification": "Require a lower-triangular directed relation and mask every future column immediately before row softmax.",
      "status": "DEFER",
      "risk": "Quadratic memory and a hidden bidirectional information path.",
      "validation_test": "Pair causality test and measured O(L^2) memory profile."
    },
    {
      "component": "Decoder and skip connections",
      "official_code_evidence": "model.py:58-73; convolutions.py:140-170 upsample /128 to /1 with repeated coarse tokens and encoder skips",
      "scientific_role": "Recover dense base-resolution predictions.",
      "market_genome_analogue": "Dense multi-resolution temporal decoder.",
      "causal_modification": "Use delayed terminal-aligned upsampling and causal convolutions.",
      "status": "CAUSALIZE",
      "risk": "A coarse token leaks later observations to its earlier fine child.",
      "validation_test": "Perturb every skip and coarse state and compare all prior outputs."
    },
    {
      "component": "Typed multi-resolution embeddings",
      "official_code_evidence": "embeddings.py:25-78 exposes 1bp 1536D, 128bp 3072D and pair 128D embeddings",
      "scientific_role": "Expose representations at task-appropriate resolutions.",
      "market_genome_analogue": "Fine and coarse typed temporal embeddings.",
      "causal_modification": "Define causal fusion and terminal timestamp contracts for every resolution.",
      "status": "REUSE_PATTERN",
      "risk": "Resolution or timestamp misalignment.",
      "validation_test": "Shape, timestamp, provenance and prefix tests."
    },
    {
      "component": "Symmetric pair embedding",